<?xml version="1.0" encoding="UTF-8"?>
<xs:schema elementFormDefault="qualified" xmlns="http://www.uniovi.es"
	targetNamespace="http://www.uniovi.es" xmlns:xs="http://www.w3.org/2001/XMLSchema">
	<xs:element name="circuito">
		<xs:complexType>
			<xs:sequence>
				<xs:element ref="nombre" />
				<xs:element ref="longitud-circuito" />
				<xs:element ref="anchura-media" />
				<xs:element ref="fecha" />
				<xs:element ref="hora" />
				<xs:element ref="vueltas" />
				<xs:element ref="localidad" />
				<xs:element ref="pais" />
				<xs:element ref="patrocinador" />
				<xs:element ref="referencias" />
				<xs:element ref="fotografias" />
				<xs:element ref="videos" />
				<xs:element ref="origen" />
				<xs:element ref="puntos" />
				<xs:element ref="vencedor" />
				<xs:element ref="clasificados" />
			</xs:sequence>
		</xs:complexType>
	</xs:element>
	<xs:element name="nombre" type="xs:string" />

	<xs:simpleType name="longitudPositiva">
		<xs:restriction base="xs:decimal">
			<xs:minExclusive value="0" />
		</xs:restriction>
	</xs:simpleType>

	<xs:complexType name="tipoLongitudCircuito">
		<xs:simpleContent>
			<xs:extension base="longitudPositiva">
				<xs:attribute name="unidades" type="xs:string" use="required" />
			</xs:extension>
		</xs:simpleContent>
	</xs:complexType>

	<xs:complexType name="tipoAnchuraMedia">
		<xs:simpleContent>
			<xs:extension base="longitudPositiva">
				<xs:attribute name="unidades" type="xs:string" use="required" />
			</xs:extension>
		</xs:simpleContent>
	</xs:complexType>

	<xs:element name="longitud-circuito" type="tipoLongitudCircuito" />
	<xs:element name="anchura-media" type="tipoAnchuraMedia" />

	<xs:element name="fecha" type="xs:date" />
	<xs:element name="hora" type="xs:time" />
	<xs:element name="vueltas" type="xs:positiveInteger" />
	<xs:element name="localidad" type="xs:string" />
	<xs:element name="pais" type="xs:string" />
	<xs:element name="patrocinador" type="xs:string" />
	<xs:element name="referencias">
		<xs:complexType>
			<xs:sequence>
				<xs:element minOccurs="3" maxOccurs="unbounded" ref="referencia" />
			</xs:sequence>
		</xs:complexType>
	</xs:element>
	<xs:element name="referencia">
		<xs:complexType>
			<xs:simpleContent>
				<xs:extension base="xs:string">
					<xs:attribute name="title" type="xs:string" use="required" />
				</xs:extension>
			</xs:simpleContent>
		</xs:complexType>
	</xs:element>
	<xs:element name="fotografias">
		<xs:complexType>
			<xs:sequence>
				<xs:element minOccurs="1" maxOccurs="5" ref="fotografia" />
			</xs:sequence>
		</xs:complexType>
	</xs:element>
	<xs:element name="fotografia">
		<xs:complexType>
			<xs:simpleContent>
				<xs:extension base="xs:string">
					<xs:attribute name="alt" type="xs:string" use="required" />
				</xs:extension>
			</xs:simpleContent>
		</xs:complexType>
	</xs:element>
	<xs:element name="videos">
		<xs:complexType>
			<xs:sequence>
				<xs:element minOccurs="1" maxOccurs="3" ref="video" />
			</xs:sequence>
		</xs:complexType>
	</xs:element>
	<xs:element name="video" type="xs:string" />
	<xs:element name="origen">
		<xs:complexType>
			<xs:sequence>
				<xs:element ref="coordenadas" />
			</xs:sequence>
		</xs:complexType>
	</xs:element>
	<xs:element name="puntos">
		<xs:complexType>
			<xs:sequence>
				<xs:element minOccurs="1" maxOccurs="unbounded" ref="punto" />
			</xs:sequence>
		</xs:complexType>
	</xs:element>
	<xs:element name="punto">
		<xs:complexType>
			<xs:sequence>
				<xs:element ref="distancia" />
				<xs:element ref="coordenadas" />
				<xs:element ref="sector" />
			</xs:sequence>
		</xs:complexType>
	</xs:element>
	<xs:element name="distancia">
		<xs:complexType>
			<xs:simpleContent>
				<xs:extension base="xs:decimal">
					<xs:attribute name="unidades" type="xs:string" use="required" />
				</xs:extension>
			</xs:simpleContent>
		</xs:complexType>
	</xs:element>
	<xs:element name="sector" type="xs:positiveInteger" />

	<!-- Estos tipos definen la restricciones de longitud y latitud -->
	<xs:simpleType name="longitudDecimal">
		<xs:restriction base="xs:decimal">
			<xs:minInclusive value="-180" />
			<xs:maxInclusive value="180" />
		</xs:restriction>
	</xs:simpleType>

	<xs:simpleType name="latitudDecimal">
		<xs:restriction base="xs:decimal">
			<xs:minInclusive value="-90" />
			<xs:maxInclusive value="90" />
		</xs:restriction>
	</xs:simpleType>

	<xs:complexType name="tipoLongitud">
		<xs:simpleContent>
			<xs:extension base="longitudDecimal">
				<xs:attribute name="unidades" type="xs:string" use="required" />
			</xs:extension>
		</xs:simpleContent>
	</xs:complexType>

	<xs:complexType name="tipoLatitud">
		<xs:simpleContent>
			<xs:extension base="latitudDecimal">
				<xs:attribute name="unidades" type="xs:string" use="required" />
			</xs:extension>
		</xs:simpleContent>
	</xs:complexType>

	<xs:complexType name="tipoAltitud">
		<xs:simpleContent>
			<xs:extension base="xs:decimal">
				<xs:attribute name="unidades" type="xs:string" use="required" />
			</xs:extension>
		</xs:simpleContent>
	</xs:complexType>

	<xs:element name="longitud" type="tipoLongitud" />
	<xs:element name="latitud" type="tipoLatitud" />
	<xs:element name="altitud" type="tipoAltitud" />

	<xs:element name="coordenadas">
		<xs:complexType>
			<xs:sequence>
				<xs:element ref="longitud" />
				<xs:element ref="latitud" />
				<xs:element ref="altitud" />
			</xs:sequence>
		</xs:complexType>
	</xs:element>

	<xs:element name="vencedor">
		<xs:complexType>
			<xs:simpleContent>
				<xs:extension base="xs:string">
					<xs:attribute name="tiempo" type="xs:duration" use="required" />
				</xs:extension>
			</xs:simpleContent>
		</xs:complexType>
	</xs:element>
	<xs:element name="clasificados">
		<xs:complexType>
			<xs:sequence>
				<xs:element ref="clasificado" />
				<xs:element ref="clasificado" />
				<xs:element ref="clasificado" />
			</xs:sequence>
		</xs:complexType>
	</xs:element>
	<xs:element name="clasificado">
		<xs:complexType>
			<xs:simpleContent>
				<xs:extension base="xs:string">
					<xs:attribute name="posicion" type="xs:positiveInteger" use="required" />
				</xs:extension>
			</xs:simpleContent>
		</xs:complexType>
	</xs:element>
</xs:schema>